{
  "requestType": "MakeApplication",
  "quoteId": 90155,
  "funderCode": "OODLEV2",
  "version": 1,
  "data": {
    "applicants": [
      {
        "isMainApplicant": true,
        "applicantType": "Personal",
        "title": "Mr",
        "forename": "Mickey",
        "middlename": "",
        "surname": "Mouse",
        "dob": "1968-01-01",
        "sexAtBirth": "m",
        "maritalStatus": "Married",
        "isUkResident": true,
        "homephone": "01511112222",
        "mobile": "07777666555",
        "email": "mickey.mouse@gmail.com",
        "drivingLicenceType": "UK Full",
        "nationality": "British",
        "residenceHistory": [
          {
            "address": {
              "unit": "",
              "houseName": "",
              "houseNumber": "12",
              "addressLine1": "Coney Green Way",
              "addressLine2": "",
              "addressLine3": "",
              "town": "Telford",
              "county": "",
              "postcode": "TF13QZ"
            },
            "orderNumber": 1,
            "residentialStatusShortcode": "Owner",
            "yearsAtAddress": 43,
            "monthsAtAddress": 5
          }
        ],
        "employmentHistory": [
          {
            "orderNumber": 1,
            "occupationType": "Other",
            "jobTitle": "Entertainer",
            "company": "Disney Corp",
            "yearsAtCompany": 43,
            "monthsAtCompany": 5,
            "employmentType": "Full time",
            "employmentStatus": "Employed",
            "phoneNumber": "00000000000",
            "address": {
              "unit": "",
              "houseName": "",
              "houseNumber": "",
              "addressLine1": "Thompson Close",
              "addressLine2": "",
              "addressLine3": "",
              "town": "Telford",
              "county": "",
              "postcode": "S419AZ"
            }
          }
        ],
        "financialStatus": {
          "annualGrossIncome": 25000,
          "affordability": "Unknown",
          "affordabilityMonthlyMortgageRentContribution": 500,
          "netMonthlyIncome": 1709
        },
        "bank": {
          "accountName": "Mickey Mouse",
          "bankName": "LLOYDS BANK PLC",
          "address": {
            "addressLine1": "PO Box 1000",
            "addressLine2": "",
            "addressLine3": "",
            "town": "",
            "county": "",
            "postcode": "BX1 1LT"
          },
          "accountNumber": "31000000",
          "sortCode": "300000",
          "years": "10",
          "months": "10"
        },
        "marketingPreference": {
          "optInEmail": true,
          "optInSms": false,
          "optInPhone": false,
          "optInPost": false
        }
      }
    ],
    "dealer": {
      "dealerId": "6859",
      "groupId": null,
      "dealerCode": "6859",
      "dealerGroupCode": null,
      "isMccWeblead": false,
      "commissionType": "Credit Score Based Pricing",
      "dealerPackageCode": null
    },
    "quote": {
      "isBusinessQuote": false,
      "quoteDate": "2023-07-03",
      "annualMileage": 30824,
      "partExchange": 0,
      "settlement": 0,
      "deposit": 5000,
      "flatRate": 0.44,
      "term": 60,
      "vehicleCashPrice": 21000,
      "isVehicleVatQualifying": false,
      "balloonValue": 0,
      "financeType": "HP",
      "apr": 0.86,
      "isDistanceSold": false,
      "settlementMonthlyAmount": 0,
      "experianCountyCourtJudgments": 0,
      "experianDefaults": 0,
      "equifaxCountyCourtJudgments": 0,
      "equifaxDefaults": 0
    },
    "asset": {
      "isCreditLimitVehicle": false,
      "make": "BMW",
      "model": "4 SERIES GRAN DIESEL COUPE",
      "style": "420d [190] xDrive Sport 5dr Auto [Business Media]",
      "assetType": "Car",
      "isNew": false,
      "vrm": "ST18EFW",
      "vin": "WBA4K52020BE94002",
      "capCode": "BM4S20PB95HDTA4",
      "currentMileage": 30824,
      "registrationDate": "2018-03-30"
    },
    "dispersalOptions": []
  }
}